,number,value,datetime_start,datetime_complete,duration,params_Adadelta_eps,params_Adadelta_lr,params_Adadelta_rho,params_Adagrad_lr,params_Adagrad_lr_decay,params_Adagrad_weight_decay,params_Adam_beta1,params_Adam_beta2,params_Adam_eps,params_Adam_lr,params_Adam_weight_decay,params_Rprop_eta1,params_Rprop_eta2,params_Rprop_lr,params_Rprop_step_size1,params_Rprop_step_size2,params_ann_type,params_do_regularization,params_dropout_rate0,params_dropout_rate1,params_dropout_rate2,params_dropout_rate3,params_dropout_rate4,params_dropout_rate5,params_eps_batch_norm0,params_eps_batch_norm1,params_eps_batch_norm2,params_eps_batch_norm3,params_eps_batch_norm4,params_eps_batch_norm5,params_hidden_size_lstm_cell0,params_hidden_size_lstm_cell1,params_hidden_size_lstm_cell2,params_hidden_size_lstm_cell3,params_hidden_size_lstm_cell4,params_hidden_size_lstm_cell5,params_lin_act,params_loss_name,params_momentum__batch_norma0,params_momentum__batch_norma1,params_momentum__batch_norma2,params_momentum__batch_norma3,params_momentum__batch_norma4,params_momentum__batch_norma5,params_number_of_hidden_stacks,params_optimizer_name,params_out_lin0,params_out_lin1,params_out_lin2,params_out_lin3,params_out_lin4,params_out_lin5,params_use_default_optimizer_args,params_use_normalization_layer,state
0,0,-0.7922781705856323,2022-08-23 08:29:51.051171,2022-08-23 08:30:56.926615,0 days 00:01:05.875444,,,,0.08795027937442436,0.017827080201161506,0.0009477056741281515,,,,,,,,,,,fnn,False,,,,,,,,,,,,,,,,,,,Softplus,MSELoss,,,,,,,3,Adagrad,64.0,16.0,1024.0,,,,False,,COMPLETE
1,1,-0.019698023796081543,2022-08-23 08:30:56.928212,2022-08-23 08:32:53.216375,0 days 00:01:56.288163,,,,,,,,,,,,,,,,,lstm,False,,,,,,,,,,,,,256.0,128.0,32.0,,,,,HuberLoss,,,,,,,3,Adagrad,,,,,,,True,,COMPLETE
2,2,-0.0018775463104248047,2022-08-23 08:32:53.217944,2022-08-23 08:38:57.720556,0 days 00:06:04.502612,9.696424516638154e-06,0.8895491865727113,0.5481489494308612,,,,,,,,,,,,,,lstm,True,0.04,0.02,0.08,0.08,0.04,0.64,,,,,,,1024.0,1024.0,32.0,128.0,256.0,1024.0,,MSELoss,,,,,,,6,Adadelta,,,,,,,False,False,COMPLETE
3,3,,2022-08-23 08:38:57.722578,2022-08-23 08:39:44.991813,0 days 00:00:47.269235,,,,0.014103589333147114,0.020318366054236633,0.0009272170356653746,,,,,,,,,,,fnn,False,,,,,,,,,,,,,,,,,,,Tanh,MSELoss,,,,,,,2,Adagrad,128.0,512.0,,,,,False,,PRUNED
4,4,,2022-08-23 08:39:44.992423,2022-08-23 08:40:01.489350,0 days 00:00:16.496927,,,,0.09360045277058687,0.06302930585665317,0.0008182400858011336,,,,,,,,,,,fnn,True,0.32,0.64,0.04,0.16,0.64,,,,,,,,,,,,,,ELU,GaussianNLLLoss,,,,,,,5,Adagrad,16.0,128.0,512.0,512.0,1024.0,,False,False,PRUNED
5,5,,2022-08-23 08:40:01.489930,2022-08-23 08:40:14.828960,0 days 00:00:13.339030,,,,0.09580556229373749,0.02699534871129181,0.0005541033564009319,,,,,,,,,,,fnn,True,0.32,0.16,,,,,,,,,,,,,,,,,GELU,GaussianNLLLoss,,,,,,,2,Adagrad,512.0,1024.0,,,,,False,False,PRUNED
6,6,,2022-08-23 08:40:14.829550,2022-08-23 08:41:03.753552,0 days 00:00:48.924002,,,,,,,,,,,,0.5950822369093522,1.1827724311644707,0.018072111973530834,5.89675961010457e-05,42.51090607433355,fnn,False,,,,,,,,,,,,,,,,,,,Mish,MSELoss,,,,,,,1,Rprop,16.0,,,,,,False,,PRUNED
7,7,,2022-08-23 08:41:03.754175,2022-08-23 08:42:01.106770,0 days 00:00:57.352595,8.707428595601895e-06,0.1987218120162081,0.7983612611254137,,,,,,,,,,,,,,lstm,True,,,,,,,5.176015959346173e-05,9.090972401102455e-06,1.3860079693045956e-05,,,,256.0,1024.0,1024.0,,,,,GaussianNLLLoss,0.11285060891549105,0.18770664691459665,0.08696546991098421,,,,3,Adadelta,,,,,,,False,True,PRUNED
8,8,,2022-08-23 08:42:01.107408,2022-08-23 08:42:20.034849,0 days 00:00:18.927441,,,,,,,,,,,,0.5373102862609974,1.1168918494519835,0.06250817947219946,3.0418357832262687e-05,7.440943636555829,fnn,True,0.32,0.16,0.64,0.08,0.08,,,,,,,,,,,,,,Softplus,MSELoss,,,,,,,5,Rprop,512.0,128.0,32.0,128.0,128.0,,False,False,PRUNED
9,9,,2022-08-23 08:42:20.035426,2022-08-23 08:43:25.312691,0 days 00:01:05.277265,,,,,,,,,,,,,,,,,fnn,False,,,,,,,,,,,,,,,,,,,CELU,MSELoss,,,,,,,6,Adam,256.0,16.0,16.0,32.0,64.0,128.0,True,,PRUNED
10,10,,2022-08-23 08:43:25.313371,2022-08-23 08:44:25.936262,0 days 00:01:00.622891,,,,,,,,,,,,,,,,,lstm,True,,,,,,,3.1909387145871834e-06,9.911223400145821e-05,9.817887892881486e-05,8.339211635908825e-05,3.222684552464563e-05,4.197119313428103e-05,1024.0,256.0,16.0,128.0,256.0,1024.0,,HuberLoss,0.18968906147731113,0.053791322637490147,0.18688515867226912,0.0650876181528407,0.12456115310004497,0.1492778554280363,6,Adadelta,,,,,,,True,True,PRUNED
11,11,,2022-08-23 08:44:25.936748,2022-08-23 08:46:25.265578,0 days 00:01:59.328830,,,,,,,,,,,,,,,,,lstm,False,,,,,,,,,,,,,1024.0,128.0,32.0,64.0,,,,HuberLoss,,,,,,,4,Adadelta,,,,,,,True,,PRUNED
12,12,,2022-08-23 08:46:25.266204,2022-08-23 08:48:26.259155,0 days 00:02:00.992951,,,,,,,,,,,,,,,,,lstm,False,,,,,,,,,,,,,256.0,1024.0,32.0,128.0,,,,HuberLoss,,,,,,,4,Adam,,,,,,,True,,PRUNED
13,13,,2022-08-23 08:48:26.259764,2022-08-23 08:51:25.998304,0 days 00:02:59.738540,,,,,,,,,,,,,,,,,lstm,True,0.04,0.02,0.08,0.01,0.04,,,,,,,,512.0,16.0,256.0,512.0,1024.0,,,HuberLoss,,,,,,,5,Adadelta,,,,,,,True,False,PRUNED
14,14,,2022-08-23 08:51:25.998912,2022-08-23 08:52:42.520627,0 days 00:01:16.521715,,,,,,,,,,,,,,,,,lstm,False,,,,,,,,,,,,,32.0,128.0,,,,,,HuberLoss,,,,,,,2,Adagrad,,,,,,,True,,PRUNED
15,15,,2022-08-23 08:52:42.521270,2022-08-23 08:54:50.202239,0 days 00:02:07.680969,,,,,,,,,,,,,,,,,lstm,True,0.16,0.01,0.08,0.64,,,,,,,,,64.0,32.0,64.0,32.0,,,,MSELoss,,,,,,,4,Adadelta,,,,,,,True,False,PRUNED
16,16,,2022-08-23 08:54:50.202849,2022-08-23 08:56:42.911839,0 days 00:01:52.708990,,,,,,,,,,,,0.4004579642207923,1.288762359449615,0.09853387304235542,9.486899014879982e-05,5.7687615927223845,lstm,False,,,,,,,,,,,,,16.0,64.0,128.0,,,,,HuberLoss,,,,,,,3,Rprop,,,,,,,False,,PRUNED
17,17,,2022-08-23 08:56:42.912552,2022-08-23 08:57:56.137745,0 days 00:01:13.225193,,,,,,,,,,,,,,,,,lstm,True,,,,,,,9.317875460908055e-05,,,,,,128.0,,,,,,,HuberLoss,0.06476978366759889,,,,,,1,Adam,,,,,,,True,True,PRUNED
18,18,,2022-08-23 08:57:56.138311,2022-08-23 09:00:26.501000,0 days 00:02:30.362689,,,,0.0026318282417048117,0.09461966857691467,0.00021895815733397365,,,,,,,,,,,lstm,False,,,,,,,,,,,,,256.0,512.0,32.0,1024.0,32.0,512.0,,MSELoss,,,,,,,6,Adagrad,,,,,,,False,,PRUNED
19,19,,2022-08-23 09:00:26.501617,2022-08-23 09:03:09.837517,0 days 00:02:43.335900,,,,,,,,,,,,,,,,,lstm,True,0.08,0.02,0.01,0.08,0.01,,,,,,,,1024.0,128.0,512.0,256.0,64.0,,,GaussianNLLLoss,,,,,,,5,Adadelta,,,,,,,True,False,PRUNED
20,20,,2022-08-23 09:03:09.838076,2022-08-23 09:04:59.820486,0 days 00:01:49.982410,,,,,,,,,,,,,,,,,lstm,False,,,,,,,,,,,,,32.0,1024.0,32.0,16.0,,,,HuberLoss,,,,,,,4,Adagrad,,,,,,,True,,PRUNED
21,21,,2022-08-23 09:04:59.821034,2022-08-23 09:05:51.012424,0 days 00:00:51.191390,,,,0.0586430570849341,0.016040216639602096,0.0006455053425572066,,,,,,,,,,,fnn,False,,,,,,,,,,,,,,,,,,,Softplus,MSELoss,,,,,,,3,Adagrad,64.0,16.0,1024.0,,,,False,,PRUNED
22,22,,2022-08-23 09:05:51.013083,2022-08-23 09:06:03.839160,0 days 00:00:12.826077,,,,0.06550362345274431,0.05004905688585329,0.00027247866009196323,,,,,,,,,,,fnn,False,,,,,,,,,,,,,,,,,,,SELU,MSELoss,,,,,,,3,Adagrad,64.0,32.0,256.0,,,,False,,PRUNED
23,23,,2022-08-23 09:06:03.839740,2022-08-23 09:06:51.391167,0 days 00:00:47.551427,,,,0.03199458153501424,0.0038782502601737295,0.0009404491963042401,,,,,,,,,,,fnn,False,,,,,,,,,,,,,,,,,,,SiLU,MSELoss,,,,,,,2,Adagrad,32.0,256.0,,,,,False,,PRUNED
24,24,,2022-08-23 09:06:51.391593,2022-08-23 09:08:25.828261,0 days 00:01:34.436668,,,,0.07604442837378286,0.04612148845354383,0.0007091771083603822,,,,,,,,,,,lstm,False,,,,,,,,,,,,,128.0,256.0,32.0,,,,,MSELoss,,,,,,,3,Adagrad,,,,,,,False,,PRUNED
25,25,,2022-08-23 09:08:25.828807,2022-08-23 09:10:24.890703,0 days 00:01:59.061896,6.640077405204395e-07,0.9513315937738263,0.23499311097197872,,,,,,,,,,,,,,lstm,False,,,,,,,,,,,,,64.0,64.0,64.0,128.0,,,,MSELoss,,,,,,,4,Adadelta,,,,,,,False,,PRUNED
26,26,,2022-08-23 09:10:24.891174,2022-08-23 09:10:37.780485,0 days 00:00:12.889311,,,,,,,0.9035796882621241,0.9597612933241254,7.542286838124666e-08,0.08880456761342986,0.0007096333906337573,,,,,,fnn,True,0.02,0.04,,,,,,,,,,,,,,,,,Softplus,MSELoss,,,,,,,2,Adam,1024.0,64.0,,,,,False,False,PRUNED
27,27,,2022-08-23 09:10:37.781149,2022-08-23 09:12:38.774588,0 days 00:02:00.993439,,,,,,,,,,,,0.4161101585056934,1.293973120045442,0.006364080570214856,7.902329223417374e-07,48.46195991918239,lstm,False,,,,,,,,,,,,,16.0,16.0,1024.0,,,,,HuberLoss,,,,,,,3,Rprop,,,,,,,False,,PRUNED
28,28,,2022-08-23 09:12:38.775208,2022-08-23 09:13:18.573415,0 days 00:00:39.798207,,,,,,,,,,,,,,,,,fnn,True,,,,,,,1.2471122677685715e-06,,,,,,,,,,,,CELU,MSELoss,0.1992338838779098,,,,,,1,Adagrad,64.0,,,,,,True,True,PRUNED
29,29,,2022-08-23 09:13:18.574087,2022-08-23 09:14:13.585400,0 days 00:00:55.011313,,,,0.03260026016525844,0.07975427127851635,0.00043059793554251055,,,,,,,,,,,fnn,False,,,,,,,,,,,,,,,,,,,SiLU,GaussianNLLLoss,,,,,,,2,Adagrad,256.0,16.0,,,,,False,,PRUNED
30,30,,2022-08-23 09:14:13.586063,2022-08-23 09:16:13.989442,0 days 00:02:00.403379,9.725412489057762e-06,0.9329214329112347,0.5584220340170052,,,,,,,,,,,,,,lstm,False,,,,,,,,,,,,,512.0,512.0,16.0,16.0,,,,MSELoss,,,,,,,4,Adadelta,,,,,,,False,,PRUNED
31,31,,2022-08-23 09:16:13.990384,2022-08-23 09:17:00.079896,0 days 00:00:46.089512,,,,,,,,,,,,,,,,,fnn,True,,,,,,,3.216873740804681e-06,,,,,,,,,,,,CELU,MSELoss,0.19689231507867486,,,,,,1,Adagrad,64.0,,,,,,True,True,PRUNED
32,32,,2022-08-23 09:17:00.080484,2022-08-23 09:17:52.108736,0 days 00:00:52.028252,,,,0.037106926127015424,0.08419245660970788,0.00038432866947311147,,,,,,,,,,,fnn,False,,,,,,,,,,,,,,,,,,,SiLU,GaussianNLLLoss,,,,,,,2,Adagrad,256.0,16.0,,,,,False,,PRUNED
33,33,,2022-08-23 09:17:52.109287,2022-08-23 09:20:35.003757,0 days 00:02:42.894470,,,,,,,,,,,,,,,,,lstm,True,0.08,0.02,0.01,0.08,0.01,,,,,,,,1024.0,128.0,512.0,256.0,64.0,,,GaussianNLLLoss,,,,,,,5,Adadelta,,,,,,,True,False,PRUNED
34,34,,2022-08-23 09:20:35.004455,2022-08-23 09:22:24.753133,0 days 00:01:49.748678,,,,,,,,,,,,,,,,,lstm,False,,,,,,,,,,,,,32.0,1024.0,32.0,16.0,,,,HuberLoss,,,,,,,4,Adagrad,,,,,,,True,,PRUNED
35,35,,2022-08-23 09:22:24.753751,2022-08-23 09:23:58.405726,0 days 00:01:33.651975,,,,,,,,,,,,,,,,,lstm,False,,,,,,,,,,,,,32.0,1024.0,32.0,,,,,HuberLoss,,,,,,,3,Adagrad,,,,,,,True,,PRUNED
36,36,,2022-08-23 09:23:58.406255,2022-08-23 09:24:49.806359,0 days 00:00:51.400104,,,,0.06367247364361833,0.002962181357214778,0.0006511766627337707,,,,,,,,,,,fnn,False,,,,,,,,,,,,,,,,,,,Softplus,MSELoss,,,,,,,3,Adagrad,64.0,16.0,1024.0,,,,False,,PRUNED
37,37,,2022-08-23 09:24:49.806970,2022-08-23 09:25:51.480259,0 days 00:01:01.673289,,,,,,,,,,,,0.4844140398427587,1.103301371499277,0.05620060573913128,8.495406938242151e-05,24.69451952617108,fnn,False,,,,,,,,,,,,,,,,,,,Softplus,MSELoss,,,,,,,3,Rprop,64.0,16.0,1024.0,,,,False,,PRUNED
38,38,,2022-08-23 09:25:51.480946,2022-08-23 09:26:38.873610,0 days 00:00:47.392664,,,,0.07440901287573781,0.0440101394331263,0.00011043542998346863,,,,,,,,,,,fnn,False,,,,,,,,,,,,,,,,,,,SELU,MSELoss,,,,,,,2,Adagrad,32.0,32.0,,,,,False,,PRUNED
39,39,,2022-08-23 09:26:38.873987,2022-08-23 09:26:52.034869,0 days 00:00:13.160882,,,,0.0821076946952504,0.06402128341061299,0.00035180818114766377,,,,,,,,,,,fnn,True,0.64,0.08,0.02,,,,,,,,,,,,,,,,SELU,MSELoss,,,,,,,3,Adagrad,128.0,32.0,256.0,,,,False,False,PRUNED
40,40,,2022-08-23 09:26:52.035439,2022-08-23 09:27:42.657145,0 days 00:00:50.621706,,,,,,,0.8522197148524928,0.9985591547392183,1.750917801594861e-09,0.0006346645209239637,0.00012965167596350755,,,,,,fnn,False,,,,,,,,,,,,,,,,,,,SiLU,MSELoss,,,,,,,2,Adam,32.0,256.0,,,,,False,,PRUNED
41,41,,2022-08-23 09:27:42.657772,2022-08-23 09:29:17.752335,0 days 00:01:35.094563,,,,0.03812955643166132,0.0030850458091033007,0.0009884683721801302,,,,,,,,,,,lstm,False,,,,,,,,,,,,,128.0,256.0,32.0,,,,,MSELoss,,,,,,,3,Adagrad,,,,,,,False,,PRUNED
42,42,,2022-08-23 09:29:17.753023,2022-08-23 09:31:54.739579,0 days 00:02:36.986556,2.4825205212782145e-07,0.9862128996605257,0.06634749113742489,,,,,,,,,,,,,,lstm,False,,,,,,,,,,,,,64.0,64.0,64.0,128.0,256.0,128.0,,MSELoss,,,,,,,6,Adadelta,,,,,,,False,,PRUNED
43,43,,2022-08-23 09:31:54.740306,2022-08-23 09:33:54.127412,0 days 00:01:59.387106,1.5786413189709392e-06,0.7254172471297218,0.23112670063113838,,,,,,,,,,,,,,lstm,False,,,,,,,,,,,,,64.0,64.0,64.0,128.0,,,,MSELoss,,,,,,,4,Adadelta,,,,,,,False,,PRUNED
44,44,,2022-08-23 09:33:54.128137,2022-08-23 09:34:08.438643,0 days 00:00:14.310506,,,,,,,0.9270388132403953,0.9508265628414053,9.239289867234561e-08,0.09831821705554106,0.0009199164533410774,,,,,,fnn,True,0.02,0.04,0.32,0.02,0.04,,,,,,,,,,,,,,Softplus,MSELoss,,,,,,,5,Adam,1024.0,64.0,64.0,16.0,32.0,,False,False,FAIL
45,45,,2022-08-23 09:34:08.439320,2022-08-23 09:34:22.831843,0 days 00:00:14.392523,,,,,,,0.9277781098680659,0.9510598394467176,9.326191896492077e-08,0.09921059215359043,0.0009013301467094983,,,,,,fnn,True,0.02,0.04,0.32,0.02,0.04,,,,,,,,,,,,,,Softplus,MSELoss,,,,,,,5,Adam,1024.0,64.0,64.0,1024.0,16.0,,False,False,FAIL
46,46,,2022-08-23 09:34:22.832388,2022-08-23 09:34:37.292079,0 days 00:00:14.459691,,,,,,,0.9272411740914718,0.9517654222211677,9.588342677646084e-08,0.09423698153311959,0.0008995498788693873,,,,,,fnn,True,0.02,0.04,0.32,0.04,0.16,,,,,,,,,,,,,,Softplus,MSELoss,,,,,,,5,Adam,1024.0,64.0,128.0,256.0,32.0,,False,False,FAIL
47,47,,2022-08-23 09:34:37.292826,2022-08-23 09:34:51.692199,0 days 00:00:14.399373,,,,,,,0.9258584912499419,0.9500288135513892,9.270067391364218e-08,0.09898883899685106,0.0008940357258680829,,,,,,fnn,True,0.02,0.04,0.32,0.02,0.16,,,,,,,,,,,,,,Softplus,MSELoss,,,,,,,5,Adam,1024.0,64.0,128.0,64.0,32.0,,False,False,FAIL
48,48,,2022-08-23 09:34:51.692732,2022-08-23 09:35:06.089799,0 days 00:00:14.397067,,,,,,,0.9304662338719013,0.9503923807221991,9.323449448306288e-08,0.09994809832316467,0.0009179930084224562,,,,,,fnn,True,0.02,0.04,0.16,0.04,0.16,,,,,,,,,,,,,,Softplus,MSELoss,,,,,,,5,Adam,1024.0,64.0,64.0,256.0,32.0,,False,False,FAIL
49,49,,2022-08-23 09:35:06.090322,2022-08-23 09:35:22.800491,0 days 00:00:16.710169,,,,,,,0.9351698412269595,0.9529596182685414,9.434485659313484e-08,0.09509798706939593,0.0008877482404032118,,,,,,fnn,True,0.02,0.04,0.16,0.04,0.02,,,,,,,,,,,,,,Softplus,MSELoss,,,,,,,5,Adam,1024.0,64.0,128.0,64.0,512.0,,False,False,PRUNED
50,50,,2022-08-23 09:35:22.801168,2022-08-23 09:35:39.440038,0 days 00:00:16.638870,,,,,,,0.8970949186443395,0.9584572966519763,7.665454391089017e-08,0.09607345553545338,0.0006847764498821515,,,,,,lstm,True,0.02,,,,,,,,,,,,256.0,,,,,,,MSELoss,,,,,,,1,Adam,,,,,,,False,False,PRUNED
51,51,,2022-08-23 09:35:39.440669,2022-08-23 09:35:53.649477,0 days 00:00:14.208808,,,,,,,,,,,,0.4012406906425305,1.2880369360088524,0.015856646926094203,1.2884377441773585e-06,49.86833804423854,fnn,True,0.04,0.04,,,,,,,,,,,,,,,,,ELU,HuberLoss,,,,,,,2,Rprop,1024.0,64.0,,,,,False,False,PRUNED
52,52,,2022-08-23 09:35:53.650046,2022-08-23 09:38:02.246855,0 days 00:02:08.596809,,,,,,,,,,,,0.47482850881457117,1.226483274874225,0.003769900308026257,2.6983396968480986e-06,32.828720606588575,lstm,True,0.01,0.32,0.32,,,,,,,,,,16.0,16.0,1024.0,,,,,HuberLoss,,,,,,,3,Rprop,,,,,,,False,False,PRUNED
53,53,,2022-08-23 09:38:02.247608,2022-08-23 09:38:57.615798,0 days 00:00:55.368190,,,,,,,,,,,,,,,,,lstm,True,,,,,,,4.0063565430285844e-05,6.496504446102275e-05,7.442941647004163e-05,1.0945025263615064e-06,9.817585246865678e-05,,16.0,16.0,1024.0,32.0,128.0,,,HuberLoss,0.14890188359993958,0.10018696338283095,0.05004344006486723,0.19758643441432538,0.060197467071598634,,5,Rprop,,,,,,,True,True,PRUNED
54,54,,2022-08-23 09:38:57.616365,2022-08-23 09:39:17.607417,0 days 00:00:19.991052,,,,,,,,,,,,,,,,,lstm,True,,,,,,,3.5312573577526495e-05,,,,,,16.0,,,,,,,HuberLoss,0.14223943011214368,,,,,,1,Rprop,,,,,,,True,True,PRUNED
55,55,,2022-08-23 09:39:17.608033,2022-08-23 09:40:08.813660,0 days 00:00:51.205627,,,,,,,,,,,,,,,,,fnn,True,,,,,,,7.284274244721001e-05,,,,,,,,,,,,CELU,GaussianNLLLoss,0.0950161631288457,,,,,,1,Adagrad,256.0,,,,,,True,True,PRUNED
56,56,,2022-08-23 09:40:08.814287,2022-08-23 09:41:20.355425,0 days 00:01:11.541138,,,,,,,,,,,,,,,,,fnn,False,,,,,,,,,,,,,,,,,,,GELU,GaussianNLLLoss,,,,,,,6,Adadelta,256.0,1024.0,64.0,1024.0,32.0,64.0,True,,PRUNED
57,57,,2022-08-23 09:41:20.356086,2022-08-23 09:42:10.329807,0 days 00:00:49.973721,,,,,,,,,,,,,,,,,fnn,False,,,,,,,,,,,,,,,,,,,Mish,GaussianNLLLoss,,,,,,,1,Adadelta,64.0,,,,,,True,,PRUNED
58,58,,2022-08-23 09:42:10.330527,2022-08-23 09:43:04.791565,0 days 00:00:54.461038,9.95514317994142e-06,0.6247478111027553,0.6306341799602048,,,,,,,,,,,,,,fnn,False,,,,,,,,,,,,,,,,,,,Tanh,GaussianNLLLoss,,,,,,,2,Adadelta,64.0,512.0,,,,,False,,PRUNED
59,59,,2022-08-23 09:43:04.792014,2022-08-23 09:44:04.649559,0 days 00:00:59.857545,,,,0.0448600588809744,0.09840361948023131,0.00046095993429613925,,,,,,,,,,,fnn,False,,,,,,,,,,,,,,,,,,,CELU,GaussianNLLLoss,,,,,,,4,Adagrad,256.0,16.0,32.0,256.0,,,False,,PRUNED
60,60,,2022-08-23 09:44:04.650246,2022-08-23 09:44:51.123138,0 days 00:00:46.472892,,,,,,,,,,,,,,,,,fnn,False,,,,,,,,,,,,,,,,,,,SiLU,MSELoss,,,,,,,2,Adagrad,64.0,16.0,,,,,True,,PRUNED
61,61,,2022-08-23 09:44:51.123852,2022-08-23 09:45:52.370364,0 days 00:01:01.246512,,,,,,,,,,,,,,,,,lstm,True,,,,,,,2.3513901738482885e-05,6.555701808048695e-06,6.427678313632562e-06,2.2637405574467606e-05,2.788236719260758e-06,9.815411537468185e-05,1024.0,128.0,512.0,256.0,16.0,1024.0,,GaussianNLLLoss,0.16804829637228486,0.16664217071552603,0.1725885009034436,0.1569074344472548,0.19226955116750588,0.05361928718956549,6,Adadelta,,,,,,,True,True,PRUNED
62,62,,2022-08-23 09:45:52.371015,2022-08-23 09:47:13.732615,0 days 00:01:21.361600,,,,,,,,,,,,,,,,,fnn,True,,,,,,,6.760137430858997e-05,4.569672746921472e-05,4.90128996691761e-05,9.770800977340123e-05,8.88302712044038e-05,1.6489584488735525e-06,,,,,,,CELU,GaussianNLLLoss,0.05115255994068649,0.12100148510630937,0.1330863113890753,0.05730198971347322,0.19908221638057733,0.18446925028896055,6,Adagrad,16.0,16.0,64.0,16.0,256.0,32.0,True,True,PRUNED
63,63,,2022-08-23 09:47:13.733168,2022-08-23 09:50:39.076572,0 days 00:03:25.343404,,,,,,,,,,,,,,,,,lstm,False,,,,,,,,,,,,,1024.0,1024.0,512.0,16.0,64.0,,,GaussianNLLLoss,,,,,,,5,Adagrad,,,,,,,True,,PRUNED
64,64,,2022-08-23 09:50:39.077189,2022-08-23 09:52:58.368265,0 days 00:02:19.291076,,,,,,,,,,,,,,,,,lstm,False,,,,,,,,,,,,,32.0,128.0,256.0,256.0,512.0,,,HuberLoss,,,,,,,5,Adadelta,,,,,,,True,,PRUNED
65,65,,2022-08-23 09:52:58.368960,2022-08-23 09:55:07.432804,0 days 00:02:09.063844,,,,,,,,,,,,,,,,,lstm,False,,,,,,,,,,,,,32.0,1024.0,32.0,64.0,256.0,,,HuberLoss,,,,,,,5,Adagrad,,,,,,,True,,PRUNED
66,66,,2022-08-23 09:55:07.433611,2022-08-23 09:56:41.763431,0 days 00:01:34.329820,,,,,,,,,,,,,,,,,lstm,False,,,,,,,,,,,,,32.0,1024.0,32.0,,,,,HuberLoss,,,,,,,3,Adagrad,,,,,,,True,,PRUNED
67,67,,2022-08-23 09:56:41.764100,2022-08-23 09:58:46.050098,0 days 00:02:04.285998,,,,,,,,,,,,0.4887719942256166,1.1012903831665608,0.05506698827610971,9.534757172742417e-05,21.29861926770054,lstm,False,,,,,,,,,,,,,256.0,1024.0,32.0,,,,,HuberLoss,,,,,,,3,Rprop,,,,,,,False,,PRUNED
68,68,,2022-08-23 09:58:46.050735,2022-08-23 10:00:22.319246,0 days 00:01:36.268511,,,,0.05907844794308005,0.033192514976935907,0.0007595957168111479,,,,,,,,,,,lstm,False,,,,,,,,,,,,,32.0,1024.0,128.0,,,,,HuberLoss,,,,,,,3,Adagrad,,,,,,,False,,PRUNED
69,69,,2022-08-23 10:00:22.319860,2022-08-23 10:00:35.111557,0 days 00:00:12.791697,,,,0.0772472631181373,0.013035078800427249,0.00013336889587328292,,,,,,,,,,,fnn,False,,,,,,,,,,,,,,,,,,,Softplus,MSELoss,,,,,,,3,Adagrad,32.0,32.0,1024.0,,,,False,,PRUNED
70,70,,2022-08-23 10:00:35.112132,2022-08-23 10:02:45.662711,0 days 00:02:10.550579,,,,,,,0.9448908325703863,0.9528865515421298,9.974708572485143e-08,0.09791625008058856,0.0009601518108653174,,,,,,lstm,True,0.02,0.04,0.16,0.04,,,,,,,,,256.0,32.0,64.0,128.0,,,,MSELoss,,,,,,,4,Adam,,,,,,,False,False,PRUNED
71,71,,2022-08-23 10:02:45.663231,2022-08-23 10:03:02.220797,0 days 00:00:16.557566,,,,,,,0.9087948266940954,0.96512293240367,8.0462401705271e-08,0.06894014853272123,0.0007623150030426763,,,,,,lstm,True,0.01,,,,,,,,,,,,256.0,,,,,,,HuberLoss,,,,,,,1,Adam,,,,,,,False,False,PRUNED
72,72,,2022-08-23 10:03:02.221210,2022-08-23 10:03:15.169769,0 days 00:00:12.948559,,,,,,,0.9444592182251986,0.9503570908496527,6.396510710988723e-08,0.045237404415981765,0.0004804148905592413,,,,,,fnn,True,0.04,0.32,,,,,,,,,,,,,,,,,ELU,HuberLoss,,,,,,,2,Adam,1024.0,64.0,,,,,False,False,PRUNED
