,number,value,datetime_start,datetime_complete,duration,params_Adadelta_eps,params_Adadelta_lr,params_Adadelta_rho,params_Adagrad_lr,params_Adagrad_lr_decay,params_Adagrad_weight_decay,params_Adam_beta1,params_Adam_beta2,params_Adam_eps,params_Adam_lr,params_Adam_weight_decay,params_Rprop_eta1,params_Rprop_eta2,params_Rprop_lr,params_Rprop_step_size1,params_Rprop_step_size2,params_ann_type,params_do_regularization,params_dropout_rate0,params_dropout_rate1,params_dropout_rate2,params_dropout_rate3,params_dropout_rate4,params_dropout_rate5,params_eps_batch_norm0,params_eps_batch_norm1,params_eps_batch_norm2,params_eps_batch_norm3,params_eps_batch_norm4,params_eps_batch_norm5,params_hidden_size_lstm_cell0,params_hidden_size_lstm_cell1,params_hidden_size_lstm_cell2,params_hidden_size_lstm_cell3,params_hidden_size_lstm_cell4,params_hidden_size_lstm_cell5,params_lin_act,params_loss_name,params_momentum__batch_norma0,params_momentum__batch_norma1,params_momentum__batch_norma2,params_momentum__batch_norma3,params_momentum__batch_norma4,params_momentum__batch_norma5,params_number_of_hidden_stacks,params_optimizer_name,params_out_lin0,params_out_lin1,params_out_lin2,params_out_lin3,params_out_lin4,params_out_lin5,params_use_default_optimizer_args,params_use_normalization_layer,state
68,68,,2022-08-23 12:01:52.895612,2022-08-23 12:04:08.105431,0 days 00:02:15.209819,,,,,,,,,,,,,,,,,lstm,False,,,,,,,,,,,,,16.0,256.0,128.0,16.0,,,,MSELoss,,,,,,,4,Rprop,,,,,,,True,,PRUNED
69,69,,2022-08-23 12:04:08.106048,2022-08-23 12:06:25.131487,0 days 00:02:17.025439,,,,,,,,,,,,,,,,,lstm,False,,,,,,,,,,,,,256.0,16.0,512.0,16.0,,,,MSELoss,,,,,,,4,Rprop,,,,,,,True,,PRUNED
70,70,,2022-08-23 12:06:25.132225,2022-08-23 12:07:23.766440,0 days 00:00:58.634215,,,,,,,,,,,,,,,,,lstm,False,,,,,,,,,,,,,16.0,,,,,,,MSELoss,,,,,,,1,Adagrad,,,,,,,True,,PRUNED
71,71,,2022-08-23 12:07:23.767000,2022-08-23 12:08:22.443912,0 days 00:00:58.676912,,,,,,,,,,,,,,,,,lstm,False,,,,,,,,,,,,,16.0,,,,,,,MSELoss,,,,,,,1,Adagrad,,,,,,,True,,PRUNED
72,72,,2022-08-23 12:08:22.444383,2022-08-23 12:09:47.465823,0 days 00:01:25.021440,,,,0.09641032961357944,0.04754909659680482,0.0005682887785175278,,,,,,,,,,,fnn,True,,,,,,,2.8128480326348353e-05,8.270303758372565e-05,6.210854962079328e-05,6.717385236515613e-05,1.466535775117376e-06,4.80019989570207e-06,,,,,,,Softplus,GaussianNLLLoss,0.07310809756611786,0.18153921131626205,0.06013101357702988,0.1847861099592554,0.19888879749766963,0.19723408509416887,6,Adagrad,1024.0,256.0,1024.0,64.0,32.0,32.0,False,True,PRUNED
73,73,,2022-08-23 12:09:47.466251,2022-08-23 12:10:41.324791,0 days 00:00:53.858540,,,,0.020044216783600976,0.019968758001020655,0.0007676033106732612,,,,,,,,,,,fnn,True,,,,,,,4.7999314210526296e-05,5.7946346030852007e-05,,,,,,,,,,,Softplus,MSELoss,0.09588968917815147,0.18093059639510872,,,,,2,Adagrad,16.0,256.0,,,,,False,True,PRUNED
74,74,,2022-08-23 12:10:41.325492,2022-08-23 12:11:40.321320,0 days 00:00:58.995828,,,,,,,,,,,,,,,,,lstm,False,,,,,,,,,,,,,256.0,,,,,,,MSELoss,,,,,,,1,Adagrad,,,,,,,True,,PRUNED
