,number,value,datetime_start,datetime_complete,duration,params_Adadelta_eps,params_Adadelta_lr,params_Adadelta_rho,params_Adagrad_lr,params_Adagrad_lr_decay,params_Adagrad_weight_decay,params_Adam_beta1,params_Adam_beta2,params_Adam_eps,params_Adam_lr,params_Adam_weight_decay,params_Rprop_eta1,params_Rprop_eta2,params_Rprop_lr,params_Rprop_step_size1,params_Rprop_step_size2,params_ann_type,params_do_regularization,params_dropout_rate0,params_dropout_rate1,params_dropout_rate2,params_dropout_rate3,params_dropout_rate4,params_dropout_rate5,params_eps_batch_norm0,params_eps_batch_norm1,params_eps_batch_norm2,params_eps_batch_norm3,params_eps_batch_norm4,params_eps_batch_norm5,params_hidden_size_lstm_cell0,params_hidden_size_lstm_cell1,params_hidden_size_lstm_cell2,params_hidden_size_lstm_cell3,params_hidden_size_lstm_cell4,params_hidden_size_lstm_cell5,params_lin_act,params_loss_name,params_momentum__batch_norma0,params_momentum__batch_norma1,params_momentum__batch_norma2,params_momentum__batch_norma3,params_momentum__batch_norma4,params_momentum__batch_norma5,params_number_of_hidden_stacks,params_optimizer_name,params_out_lin0,params_out_lin1,params_out_lin2,params_out_lin3,params_out_lin4,params_out_lin5,params_use_default_optimizer_args,params_use_normalization_layer,state
72,72,,2022-08-23 08:21:44.618417,2022-08-23 08:24:43.041705,0 days 00:02:58.423288,,,,,,,,,,,,0.4073549689226306,1.1479854829558376,0.036858091929961,9.710824373615102e-05,13.358780348645952,lstm,True,0.16,0.04,0.32,0.02,0.08,,,,,,,,512.0,16.0,1024.0,64.0,32.0,,,GaussianNLLLoss,,,,,,,5,Rprop,,,,,,,False,False,PRUNED
73,73,,2022-08-23 08:24:43.042401,2022-08-23 08:25:41.024338,0 days 00:00:57.981937,,,,,,,,,,,,,,,,,fnn,False,,,,,,,,,,,,,,,,,,,ELU,HuberLoss,,,,,,,5,Adagrad,16.0,128.0,128.0,128.0,1024.0,,True,,PRUNED
74,74,,2022-08-23 08:25:41.024963,2022-08-23 08:26:24.610229,0 days 00:00:43.585266,,,,,,,,,,,,,,,,,fnn,False,,,,,,,,,,,,,,,,,,,ELU,HuberLoss,,,,,,,1,Adagrad,256.0,,,,,,True,,PRUNED
