,number,value,datetime_start,datetime_complete,duration,params_Adadelta_eps,params_Adadelta_lr,params_Adadelta_rho,params_Adagrad_lr,params_Adagrad_lr_decay,params_Adagrad_weight_decay,params_Adam_beta1,params_Adam_beta2,params_Adam_eps,params_Adam_lr,params_Adam_weight_decay,params_Rprop_eta1,params_Rprop_eta2,params_Rprop_lr,params_Rprop_step_size1,params_Rprop_step_size2,params_ann_type,params_do_regularization,params_dropout_rate0,params_dropout_rate1,params_dropout_rate2,params_dropout_rate3,params_dropout_rate4,params_dropout_rate5,params_eps_batch_norm0,params_eps_batch_norm1,params_eps_batch_norm2,params_eps_batch_norm3,params_eps_batch_norm4,params_eps_batch_norm5,params_hidden_size_lstm_cell0,params_hidden_size_lstm_cell1,params_hidden_size_lstm_cell2,params_hidden_size_lstm_cell3,params_hidden_size_lstm_cell4,params_hidden_size_lstm_cell5,params_lin_act,params_loss_name,params_momentum__batch_norma0,params_momentum__batch_norma1,params_momentum__batch_norma2,params_momentum__batch_norma3,params_momentum__batch_norma4,params_momentum__batch_norma5,params_number_of_hidden_stacks,params_optimizer_name,params_out_lin0,params_out_lin1,params_out_lin2,params_out_lin3,params_out_lin4,params_out_lin5,params_use_default_optimizer_args,params_use_normalization_layer,state
73,73,,2022-08-23 10:03:15.170452,2022-08-23 10:04:48.762554,0 days 00:01:33.592102,,,,,,,,,,,,0.44094149407823774,1.2371602250992018,0.02266170822646908,1.0389891611335827e-06,35.208584576599534,lstm,True,0.04,0.32,,,,,,,,,,,16.0,16.0,,,,,,HuberLoss,,,,,,,2,Rprop,,,,,,,False,False,PRUNED
74,74,,2022-08-23 10:04:48.763148,2022-08-23 10:06:41.438580,0 days 00:01:52.675432,,,,,,,,,,,,,,,,,lstm,True,,,,,,,3.368997526083572e-05,7.627028442976316e-05,,,,,16.0,16.0,,,,,,HuberLoss,0.14267727849796977,0.09141848530611527,,,,,2,Rprop,,,,,,,True,True,PRUNED
